{
  "snapshotVersion": "dashboard-snapshot/v1",
  "runtimeId": "runtime-synthetic-0001",
  "cursor": "mission-cursor-q7dKp4wN8xT2",
  "digest": "6dc970704498d43445023241c0dac7efdcf97cdaa3d28adae2d861cdd0764b34",
  "latestEventDigest": "d7fb71af32a292bf5533b6765b9a0039cb735a78bdc6e024f67327c819dc9cd1",
  "currentRun": {
    "mode": "degradedLive",
    "missionId": "mission-synthetic-0001",
    "runId": "run-synthetic-0001"
  },
  "state": {
    "canonicalizationVersion": 1,
    "stateVersion": 1,
    "currentMission": {
      "identifier": "mission-synthetic-0001",
      "lifecycle": "PLANNED",
      "predecessorIdentifier": null
    },
    "fleet": [
      {
        "identifier": "drone-comms-03",
        "participation": "DECLARED_ONLY"
      },
      {
        "identifier": "drone-sim-01",
        "participation": "SIMULATED",
        "connectivity": "CONNECTED",
        "telemetry": {
          "latitudeMicrodegrees": 44475000,
          "longitudeMicrodegrees": -79245000,
          "batteryPercent": 96,
          "altitudeMetres": 83,
          "headingDegrees": 45,
          "groundSpeedCentimetresPerSecond": 950
        }
      }
    ],
    "latestAuditOrdinal": 4,
    "sectors": [
      {
        "identifier": "sector-01",
        "state": "ASSIGNED",
        "assignedMemberId": "drone-sim-01"
      }
    ]
  },
  "timeline": [
    {
      "auditOrdinal": 1,
      "event": {
        "kind": "missionLifecycle",
        "eventClass": "MISSION",
        "mission": "mission-synthetic-0001",
        "time": "2026-08-24T12:00:01.000Z",
        "data": {
          "lifecycle": "PLANNED"
        }
      }
    },
    {
      "auditOrdinal": 2,
      "event": {
        "kind": "connectivityChanged",
        "eventClass": "CONNECTIVITY",
        "mission": "mission-synthetic-0001",
        "time": "2026-08-24T12:00:02.000Z",
        "data": {
          "droneId": "drone-sim-01",
          "connectivity": "CONNECTED"
        }
      }
    },
    {
      "auditOrdinal": 3,
      "event": {
        "kind": "sectorLifecycle",
        "eventClass": "MISSION",
        "mission": "mission-synthetic-0001",
        "time": "2026-08-24T12:00:03.000Z",
        "data": {
          "sectorId": "sector-01",
          "state": "ASSIGNED",
          "assignedMemberId": "drone-sim-01"
        }
      }
    }
  ]
}
